{
  "$schema":"https://json-schema.org/draft/2020-12/schema","$id":"https://kaveep.dev/dev-agent/schemas/durable-run-record.schema.json","title":"KAVEEP DEV-AGENT Durable Run Record","type":"object",
  "required":["durableRunId","schemaVersion","formatVersion","attempt","inputArtifactHash","resultArtifactHash","lastEventHash","lastSequence","state","status","createdAt","updatedAt"],
  "properties":{"durableRunId":{"type":"string","pattern":"^dev_run_[A-Za-z0-9][A-Za-z0-9_-]*$"},"schemaVersion":{"type":"string","pattern":"^[0-9]+\\.[0-9]+\\.[0-9]+$"},"formatVersion":{"type":"string","pattern":"^[0-9]+\\.[0-9]+\\.[0-9]+$"},"attempt":{"type":"integer","minimum":1},"parentRunRef":{"type":"string","pattern":"^dev_run_[A-Za-z0-9][A-Za-z0-9_-]*$"},"inputArtifactHash":{"type":"string","pattern":"^[a-f0-9]{64}$"},"resultArtifactHash":{"type":["string","null"],"pattern":"^[a-f0-9]{64}$"},"lastEventHash":{"type":"string","pattern":"^[a-f0-9]{64}$"},"lastSequence":{"type":"integer","minimum":0},"state":{"type":"string","enum":["received","governance_prechecked","interpreted","repository_inspected","context_built","planned","governance_postchecked","completed","blocked","no_action","failed"]},"status":{"type":"string","enum":["active","completed","completed_with_warnings","blocked","no_action","failed","unverified"]},"createdAt":{"type":"string","format":"date-time"},"updatedAt":{"type":"string","format":"date-time"}},"additionalProperties":false
}
