{"durableRunId":"dev_run_persist_001","schemaVersion":"1.0.0","formatVersion":"1.0.0","attempt":1,"inputArtifactHash":"aaaaaaaaaaaaaaaaaaaaaaaaaaaaaaaaaaaaaaaaaaaaaaaaaaaaaaaaaaaaaaaa","resultArtifactHash":"bbbbbbbbbbbbbbbbbbbbbbbbbbbbbbbbbbbbbbbbbbbbbbbbbbbbbbbbbbbbbbbb","lastEventHash":"cccccccccccccccccccccccccccccccccccccccccccccccccccccccccccccccc","lastSequence":9,"state":"completed","status":"completed","createdAt":"2026-07-10T00:00:00.000Z","updatedAt":"2026-07-10T00:00:00.000Z"}
